{"type":"config","name":"Optimize shifthtml rendering performance","metricName":"render_ms","metricUnit":"ms","bestDirection":"lower"}
{"run":1,"commit":"725dbcf","metric":2.9511,"metrics":{"compiled_ms":2.6817,"build_ms":2.9655},"status":"keep","description":"Baseline: shifthtml render performance","timestamp":1775542936289,"segment":0}
{"run":2,"commit":"61b67b2","metric":2.508,"metrics":{"compiled_ms":2.6715,"build_ms":2.4827},"status":"keep","description":"Skip RenderContext when no plugins/max_nodes/max_depth","timestamp":1775543031941,"segment":0}
{"run":3,"commit":"86907f6","metric":2.2129,"metrics":{"compiled_ms":2.5003,"build_ms":2.2604},"status":"keep","description":"Inline plain string escape in stream_children, skip generator","timestamp":1775543053860,"segment":0}
{"run":4,"commit":"37d0e4a","metric":2.17,"metrics":{"compiled_ms":2.3562,"build_ms":2.1952},"status":"keep","description":"Cache close tags, fast-path empty attrs in render_open_tag","timestamp":1775543128921,"segment":0}
{"run":5,"commit":"674ea05","metric":2.1546,"metrics":{"compiled_ms":2.3,"build_ms":2.1474},"status":"keep","description":"Remove typed None assignments in Element.__init__ (use untyped)","timestamp":1775543169880,"segment":0}
{"run":6,"commit":"e643401","metric":1.9806,"metrics":{"compiled_ms":2.385,"build_ms":1.9977},"status":"keep","description":"Add _collect() non-generator fast path for render()","timestamp":1775543330129,"segment":0}
{"run":7,"commit":"nxxkyrr","metric":2.109,"metrics":{"compiled_ms":2.3942,"build_ms":2.0175},"status":"discard","description":"Frozenset attr escape check — slower than inline 'in' checks","timestamp":1775543388784,"segment":0}
{"run":8,"commit":"nxxkyrr","metric":1.9983,"metrics":{"compiled_ms":2.3142,"build_ms":1.9868},"status":"discard","description":"Cache buf.append + check children empty — no improvement","timestamp":1775543413473,"segment":0}
{"run":9,"commit":"nxxkyrr","metric":2.0565,"metrics":{"compiled_ms":2.357,"build_ms":1.9318},"status":"discard","description":"Inline _needs_escape in stream_children and _collect_children","timestamp":1775543445240,"segment":0}
{"run":10,"commit":"c60ee7f","metric":1.7904,"metrics":{"compiled_ms":2.1448,"build_ms":1.711},"status":"keep","description":"Reorder isinstance checks: tuple first in __rshift__, Fragment first in _flatten_into","timestamp":1775543496126,"segment":0}
{"run":11,"commit":"nxxkyrr","metric":1.8251,"metrics":{"compiled_ms":2.2251,"build_ms":1.8955},"status":"discard","description":"Reorder Fragment.__rshift__ isinstance checks — within noise","timestamp":1775543517221,"segment":0}
{"run":12,"commit":"7376477","metric":1.7608,"metrics":{"compiled_ms":2.0852,"build_ms":1.7002},"status":"keep","description":"Reorder _collect_result: Node first, then str, then tuple","timestamp":1775543548020,"segment":0}
{"run":13,"commit":"acac72c","metric":1.7314,"metrics":{"compiled_ms":1.9246,"build_ms":1.7028},"status":"keep","description":"Use _collect_result in compiled _exec_ops instead of render_result","timestamp":1775543574864,"segment":0}
{"run":14,"commit":"nxxkyrr","metric":1.7463,"metrics":{"compiled_ms":1.9213,"build_ms":1.6931},"status":"discard","description":"Cache _open_tag at init — neutral (saves render, adds to init)","timestamp":1775543725982,"segment":0}
{"run":15,"commit":"495e4b8","metric":1.6896,"metrics":{"compiled_ms":1.9021,"build_ms":1.6547},"status":"keep","description":"Skip super().__init__() in Element, inline parent_node/children init","timestamp":1775543777441,"segment":0}
{"run":16,"commit":"8057288","metric":1.683,"metrics":{"compiled_ms":1.8907,"build_ms":1.6814},"status":"keep","description":"Skip super().__init__() in Comment, Lazy, Async, ConditionalNode, IterationNode","timestamp":1775543817542,"segment":0}
{"run":17,"commit":"nttlzmr","metric":1.7548,"metrics":{"compiled_ms":1.9374,"build_ms":1.71},"status":"discard","description":"Extract _render_attr_pair + genexpr in render_open_tag — worse","timestamp":1775543854694,"segment":0}
{"run":18,"commit":"aae9709","metric":1.6704,"metrics":{"compiled_ms":1.8611,"build_ms":1.6334},"status":"keep","description":"Simplify Element._collect: remove temp variable, reduce branches","timestamp":1775543881896,"segment":0}
{"run":19,"commit":"eb7b0c8","metric":1.597,"metrics":{"compiled_ms":1.7791,"build_ms":1.5463},"status":"keep","description":"Fast-path render_open_tag for single string attribute (most common)","timestamp":1775544014347,"segment":0}
{"run":20,"commit":"nttlzmr","metric":1.6014,"metrics":{"compiled_ms":1.7659,"build_ms":1.5414},"status":"discard","description":"Add 2-attribute fast path in render_open_tag — no improvement","timestamp":1775544041257,"segment":0}
{"run":21,"commit":"8264d40","metric":1.5777,"metrics":{"compiled_ms":1.7718,"build_ms":1.5419},"status":"keep","description":"Inline single-child fast path in Element._collect (74% of elements)","timestamp":1775544096615,"segment":0}
{"run":22,"commit":"b269e02","metric":1.5707,"metrics":{"compiled_ms":1.7562,"build_ms":1.5187},"status":"keep","description":"Eliminate iter()+next() in render_open_tag, simplify _collect branches","timestamp":1775544170694,"segment":0}
{"run":23,"commit":"nttlzmr","metric":1.5785,"metrics":{"compiled_ms":1.7696,"build_ms":1.5366},"status":"discard","description":"Replace match/case with isinstance in _exec_ops — within noise","timestamp":1775544200116,"segment":0}
{"run":24,"commit":"nttlzmr","metric":1.5913,"metrics":{"compiled_ms":1.7819,"build_ms":1.5491},"status":"discard","description":"Batch leaf elements into single f-string — within noise","timestamp":1775544243647,"segment":0}
{"run":25,"commit":"nttlzmr","metric":1.565,"metrics":{"compiled_ms":1.7516,"build_ms":1.527},"status":"discard","description":"Inline _render_attrs in _collect — within noise","timestamp":1775544265475,"segment":0}
{"run":26,"commit":"rnlkzzw","metric":1.5828,"metrics":{"compiled_ms":1.7804,"build_ms":1.5482},"status":"discard","description":"Cache _open_tag at init (v2) — neutral for build+render","timestamp":1775544374370,"segment":0}
{"run":27,"commit":"rnlkzzw","metric":1.5748,"metrics":{"compiled_ms":1.7882,"build_ms":1.535},"status":"discard","description":"Inline render_open_tag in _collect — within noise","timestamp":1775544456199,"segment":0}
{"run":28,"commit":"36e2458","metric":1.4586,"metrics":{"compiled_ms":1.6552,"build_ms":1.417},"status":"keep","description":"Use type() is for hot type checks in __rshift__ and _flatten_into","timestamp":1775544497423,"segment":0}
{"run":29,"commit":"0a0dadf","metric":1.4359,"metrics":{"compiled_ms":1.6232,"build_ms":1.4013},"status":"keep","description":"Use type() is str in _collect_children, _collect_result, stream_children","timestamp":1775544536607,"segment":0}
{"run":30,"commit":"cfeff0d","metric":1.439,"metrics":{"compiled_ms":1.631,"build_ms":1.3977},"status":"keep","description":"Use type() is str in Element._collect for children/attrs checks","timestamp":1775544566023,"segment":0}
{"run":31,"commit":"2d6a087","metric":1.4233,"metrics":{"compiled_ms":1.6086,"build_ms":1.3802},"status":"keep","description":"Skip _render_attrs() call in _collect, inline style check","timestamp":1775544630855,"segment":0}
{"run":32,"commit":"fa86d4a","metric":1.4048,"metrics":{"compiled_ms":1.5868,"build_ms":1.3585},"status":"keep","description":"Use iter(d)+d[k] instead of items() unpack for single-attr dicts","timestamp":1775544701815,"segment":0}
{"run":33,"commit":"qpvrvrs","metric":1.409,"metrics":{"compiled_ms":1.5954,"build_ms":1.3621},"status":"discard","description":"Reorder attr count checks (1-attr first) — within noise","timestamp":1775544751022,"segment":0}
{"run":34,"commit":"6b7c4dc","metric":1.4101,"metrics":{"compiled_ms":1.5865,"build_ms":1.3667},"status":"keep","description":"Use type() is str + isinstance in _exec_ops, reorder Loop before Branch","timestamp":1775544792202,"segment":0}
{"run":35,"commit":"qpvrvrs","metric":1.4884,"metrics":{"compiled_ms":1.6837,"build_ms":1.3803},"status":"discard","description":"Concat open+text+close for leaf elements — f-string overhead worse","timestamp":1775544817192,"segment":0}
{"run":36,"commit":"2a954d7","metric":1.402,"metrics":{"compiled_ms":1.5842,"build_ms":1.3618},"status":"keep","description":"Cache len(children) in _collect, reduce branch count","timestamp":1775544852858,"segment":0}
{"run":37,"commit":"fde9818","metric":1.4204,"metrics":{"compiled_ms":1.6015,"build_ms":1.374},"status":"keep","description":"Fix ty errors: add _collect to Renderable, fix type narrowing","timestamp":1775544986877,"segment":0}
{"run":38,"commit":"b9c8b31","metric":1.408,"metrics":{"compiled_ms":1.6282,"build_ms":1.39},"status":"keep","description":"Use (k,)=d tuple unpack instead of next(iter(d)) for single-attr dicts","timestamp":1775575518934,"segment":0}
{"run":39,"commit":"yooxnxm","metric":1.4267,"metrics":{"compiled_ms":1.6086,"build_ms":1.4079},"status":"discard","description":"Use type() is Fragment in __rshift__ and _flatten_into — within noise","timestamp":1775575564485,"segment":0}
{"run":40,"commit":"yooxnxm","metric":1.4053,"metrics":{"compiled_ms":1.6021,"build_ms":1.3762},"status":"discard","description":"Check isinstance(Node) before Template in _collect_children — within noise","timestamp":1775575620046,"segment":0}
{"run":41,"commit":"yooxnxm","metric":1.4062,"metrics":{"compiled_ms":1.6297,"build_ms":1.3825},"status":"discard","description":"Cache empty plugins tuple and empty args dict — within noise","timestamp":1775575685590,"segment":0}
{"run":42,"commit":"3a76771","metric":1.3775,"metrics":{"compiled_ms":1.5767,"build_ms":1.3309},"status":"keep","description":"Split _collect for VoidElement, remove void/doctype checks from hot path","timestamp":1775575771159,"segment":0}
{"run":43,"commit":"yooxnxm","metric":1.4072,"metrics":{"compiled_ms":1.6374,"build_ms":1.3546},"status":"discard","description":"Fast-path single-kwarg in Element.__init__ — worse due to extra branch","timestamp":1775575819052,"segment":0}
{"run":44,"commit":"9aea866","metric":1.3989,"metrics":{"compiled_ms":1.5574,"build_ms":1.3387},"status":"keep","description":"Cache bare open tag as ClassVar, avoid f-string for 0-attr elements","timestamp":1775575859355,"segment":0}
{"run":45,"commit":"5206b9c","metric":1.3212,"metrics":{"compiled_ms":1.5221,"build_ms":1.2785},"status":"keep","description":"Defer Fragment creation in __rshift__ for tuple/str/list paths","timestamp":1775577606587,"segment":0}
{"run":46,"commit":"yooxnxm","metric":1.4606,"metrics":{"compiled_ms":1.6481,"build_ms":1.3631},"status":"discard","description":"Inline _attr_name_cache lookup in __init__ — slower than try/except","timestamp":1775577660048,"segment":0}
{"run":47,"commit":"yooxnxm","metric":1.3505,"metrics":{"compiled_ms":1.5733,"build_ms":1.3181},"status":"discard","description":"Short-circuit Fragment.__str__ to bypass render() — within noise","timestamp":1775578084244,"segment":0}
{"run":48,"commit":"2cdff70","metric":1.338,"metrics":{"compiled_ms":1.5526,"build_ms":1.2964},"status":"keep","description":"Cache tag prefix as ClassVar, reduce f-string interpolations in _collect","timestamp":1775581120603,"segment":0}
{"run":49,"commit":"yooxnxm","metric":1.3311,"metrics":{"compiled_ms":1.5397,"build_ms":1.2907},"status":"checks_failed","description":"Fast-path _collect_children for all-Node children — breaks mixed children","timestamp":1775581222193,"segment":0}
{"run":50,"commit":"dd773dd","metric":1.3254,"metrics":{"compiled_ms":1.543,"build_ms":1.2875},"status":"keep","description":"Move doctype handling to HTMLRootElement._collect, skip check on 877 other elements","timestamp":1775581595812,"segment":0}
{"run":51,"commit":"985d684","metric":1.3383,"metrics":{"compiled_ms":1.5384,"build_ms":1.3621},"status":"keep","description":"Fix unused import in tags.py","timestamp":1775581780556,"segment":0}
{"run":52,"commit":"1d7ff12","metric":1.3102,"metrics":{"compiled_ms":1.5149,"build_ms":1.2678},"status":"keep","description":"Skip append_child validation in Fragment.append after _copy_tree (fresh root)","timestamp":1775581897402,"segment":0}
{"run":53,"commit":"aec5ddd","metric":1.3072,"metrics":{"compiled_ms":1.5277,"build_ms":1.2682},"status":"keep","description":"Skip append_child validation in _copy_tree (fresh copies have no parent)","timestamp":1775581932402,"segment":0}
{"run":54,"commit":"df12506","metric":1.3098,"metrics":{"compiled_ms":1.5019,"build_ms":1.267},"status":"keep","description":"Use __replace__ directly instead of copy.replace in _copy_tree","timestamp":1775582017991,"segment":0}
{"run":55,"commit":"e110275","metric":1.2866,"metrics":{"compiled_ms":1.5038,"build_ms":1.24},"status":"keep","description":"Use object.__new__ in Element.__replace__ to skip __init__ overhead","timestamp":1775582048547,"segment":0}
{"run":56,"commit":"68103ea","metric":1.2934,"metrics":{"compiled_ms":1.5188,"build_ms":1.2549},"status":"keep","description":"Use {**d} instead of dict(d) for attr copy in __replace__","timestamp":1775582073838,"segment":0}
{"run":57,"commit":"ca6afb4","metric":1.2875,"metrics":{"compiled_ms":1.524,"build_ms":1.2522},"status":"keep","description":"Fix ty error: add isinstance(Node) guard in _copy_tree","timestamp":1775582109187,"segment":0}
{"run":58,"commit":"xvuykzs","metric":1.2917,"metrics":{"compiled_ms":1.5038,"build_ms":1.2446},"status":"discard","description":"Reorder __rshift__: str before tuple — within noise","timestamp":1775582185606,"segment":0}
{"run":59,"commit":"d2646be","metric":1.3037,"metrics":{"compiled_ms":1.4911,"build_ms":1.247},"status":"keep","description":"Steady state confirmation: 56% improvement, all checks clean","timestamp":1775582215040,"segment":0}
{"run":60,"commit":"14ffb80","metric":1.3068,"metrics":{"compiled_ms":1.5086,"build_ms":1.2513},"status":"keep","description":"Simplify Element.__init__: remove inlined cache, use _convert_attribute_names","timestamp":1775582246557,"segment":0}
{"run":61,"commit":"50da2d2","metric":1.257,"metrics":{"compiled_ms":1.4599,"build_ms":1.232},"status":"keep","description":"Fast-path single-kwarg in Element.__init__: avoid dict comprehension","timestamp":1775582312178,"segment":0}
{"run":62,"commit":"xvuykzs","metric":1.2727,"metrics":{"compiled_ms":1.4639,"build_ms":1.2256},"status":"discard","description":"Reuse item var in _flatten_into Fragment path — within noise","timestamp":1775582352411,"segment":0}
{"run":63,"commit":"eeb39d2","metric":1.2603,"metrics":{"compiled_ms":1.4713,"build_ms":1.232},"status":"keep","description":"Steady state: ~57% improvement, profile very flat, approaching pure-Python limits","timestamp":1775582391316,"segment":0}
{"run":64,"commit":"697a392","metric":1.2552,"metrics":{"compiled_ms":1.4656,"build_ms":1.2208},"status":"keep","description":"Pure Python optimization exhausted. 57.4% improvement from baseline.","timestamp":1775582465309,"segment":0}
{"run":65,"commit":"f791075","metric":1.2676,"metrics":{"compiled_ms":1.4766,"build_ms":1.2307},"status":"keep","description":"Continued searching: no further gains found, 57% improvement stable","timestamp":1775582527713,"segment":0}
{"run":66,"commit":"610b9fd","metric":1.2464,"metrics":{"compiled_ms":1.4644,"build_ms":1.2039},"status":"keep","description":"Inline _attr_name_cache try/except in single-kwarg __init__ path","timestamp":1775582560488,"segment":0}
{"run":67,"commit":"xvuykzs","metric":1.2612,"metrics":{"compiled_ms":1.4719,"build_ms":1.2221},"status":"discard","description":"Reorder __init__ to check keyword_attributes first — within noise","timestamp":1775582615852,"segment":0}
{"run":68,"commit":"06fdfe2","metric":1.3406,"metrics":{"compiled_ms":1.5909,"build_ms":1.3031},"status":"keep","description":"Confirming steady state. Noisy run (1.34), best consistent ~1.25ms","timestamp":1775582652185,"segment":0}
{"run":69,"commit":"xvuykzs","metric":1.2861,"metrics":{"compiled_ms":1.4992,"build_ms":1.2367},"status":"discard","description":"Inline 2-child path in _collect — lambda overhead offsets savings","timestamp":1775582695740,"segment":0}
{"run":70,"commit":"f831ce6","metric":1.2546,"metrics":{"compiled_ms":1.4583,"build_ms":1.2064},"status":"keep","description":"Stable at ~1.25ms. Fully explored pure-Python optimization space.","timestamp":1775582706904,"segment":0}
{"run":71,"commit":"f6c44cc","metric":1.2735,"metrics":{"compiled_ms":1.4621,"build_ms":1.2091},"status":"keep","description":"Add collect_string() non-generator for Template rendering in _collect paths","timestamp":1775582805854,"segment":0}
{"run":72,"commit":"f2fe9cd","metric":1.2427,"metrics":{"compiled_ms":1.4501,"build_ms":1.2012},"status":"keep","description":"Fix ruff lint: sort imports","timestamp":1775582828305,"segment":0}
{"run":73,"commit":"362cd4a","metric":1.2544,"metrics":{"compiled_ms":1.4667,"build_ms":1.2102},"status":"keep","description":"Use collect_string in _collect_result Template path too","timestamp":1775582850337,"segment":0}
{"run":74,"commit":"xvtrttr","metric":1.2976,"metrics":{"compiled_ms":1.5104,"build_ms":1.2478},"status":"discard","description":"Inline _flatten_into in __rshift__ tuple path — larger bytecode hurts","timestamp":1775614846128,"segment":0}
{"run":75,"commit":"xvtrttr","metric":1.2885,"metrics":{"compiled_ms":1.548,"build_ms":1.222},"status":"discard","description":"Use try/except instead of len() for single-attr check — try setup cost offsets","timestamp":1775614922069,"segment":0}
{"run":76,"commit":"xvtrttr","metric":1.2891,"metrics":{"compiled_ms":1.5201,"build_ms":1.2328},"status":"discard","description":"Pre-compute class_prefix ClassVar — branch cost offsets f-string savings","timestamp":1775615020002,"segment":0}
{"run":77,"commit":"b60bc08","metric":1.2676,"metrics":{"compiled_ms":1.4936,"build_ms":1.2343},"status":"keep","description":"Steady state 1.27ms. All experiments in this session below noise threshold.","timestamp":1775615035676,"segment":0}
{"run":78,"commit":"2d81840","metric":1.3005,"metrics":{"compiled_ms":1.4689,"build_ms":1.2327},"status":"keep","description":"No further pure-Python optimizations found. Final: ~57% improvement.","timestamp":1775615110817,"segment":0}
{"type":"config","name":"Optimize shifthtml compiled template render time","metricName":"compiled_ms","metricUnit":"ms","bestDirection":"lower"}
{"run":1,"commit":"fbd0f8c","metric":1.33,"metrics":{"render_ms":1.2658,"build_ms":1.474},"status":"keep","description":"Baseline: compiled template render time","timestamp":1775615643044,"segment":0}
{"run":2,"commit":"97685b8","metric":1.2996,"metrics":{"render_ms":1.2772,"build_ms":1.4545},"status":"keep","description":"Add __subclasshook__ to Renderable — fast isinstance via _collect check only","timestamp":1775615864036,"segment":0}
{"run":3,"commit":"oxytpzt","metric":1.3111,"metrics":{"render_ms":1.2721,"build_ms":1.4347},"status":"discard","description":"Inline Loop body dispatch — no improvement over subclasshook alone","timestamp":1775615951794,"segment":0}
{"run":4,"commit":"3317312","metric":1.3562,"metrics":{"render_ms":1.3169,"build_ms":1.4969},"status":"keep","description":"Confirmed subclasshook impact: best 1.30ms, noisy runs 1.31-1.38ms","timestamp":1775616008071,"segment":0}
{"run":5,"commit":"oxytpzt","metric":1.4015,"metrics":{"render_ms":1.3074,"build_ms":1.4568},"status":"discard","description":"Optimize collect_string conversion — conditional expr slower","timestamp":1775616039550,"segment":0}
{"run":6,"commit":"c81a525","metric":1.3943,"metrics":{"render_ms":1.306,"build_ms":1.5723},"status":"keep","description":"Compiled path bottleneck is Loop body (same as direct). __subclasshook__ is the main compiled-specific win.","timestamp":1775616101654,"segment":0}
{"run":7,"commit":"0ae5357","metric":1.3296,"metrics":{"render_ms":1.3116,"build_ms":1.4777},"status":"keep","description":"Fix line length in collect_string, revert conditional expr to two-step convert","timestamp":1775616146619,"segment":0}
{"run":8,"commit":"4a2bb24","metric":1.3111,"metrics":{"render_ms":1.2657,"build_ms":1.4543},"status":"keep","description":"Compiled path at ~1.31ms. Bottleneck is Loop body (tree build+render), same as direct path.","timestamp":1775616168818,"segment":0}
